index,rank,name_russian,name_original,year,reason,summary
1363,170,Последний жулик,,1966,Advertisement/promotional text,"The Last Crook The Last Crook (film, 1966) Pēdējais blēdis 1966 comedy Soviet Union USSR About the film Creators and actors Video Review Stills Publications Film in collections Watch online More From the director Similar Awards Posters the film 1 2 3 4 5 6 7 8 9 10 — Viewers (0) — film. ru — IMDb Information Country Soviet Union USSR Year 1966 Genre Comedy Premiere November 25, 1966 (WORLD) About the film After leaving prison, the swindler Petya Dachnikov immediately returned to his craft"
1366,173,Пылающие джунгли,Burning Jungle,1966,Advertisement/promotional text,"Burning JungleOfegeHow Do You Feel19783:21ArtistOfegeRecommended based on this songBack To FunkyPasteur LappeHoliday ActionLivy EkemezieSexy DancerKiki GyanNa Real Sekele Fo'YaPasteur LappeGreetingsJoni HaastrupPopular Tracks by OfegeIt's Not Easy16,922,062Whizzy Ilabo441,356Nobody Fails630,656Burning Jungle814,779Popular Releases by OfegeTry and LoveAlbum • 1973How Do You FeelAlbum • 1978Higher Plane BreezeAlbum • 197751 Lex Presents: Lead Me On (Special Edition)Album • 2006The Last of the OriginsAlbum • 1976Popular Albums by Ofege51 Lex Presents: Lead Me On (Special Edition)Album • 2006How Do You FeelAlbum • 1978Higher Plane BreezeAlbum • 1977The Last of the OriginsAlbum • 1976Try and LoveAlbum • 1973Recommended releasesNa Man Pass ManAlbum • 1979Friday NightAlbum • 2016IvorySingle • 2025Next Stop Soweto 4: Zulu Rock, Afro-Disco & Mbaqanga 1975-1985Compilation • 2015Wake Up Your MindAlbum • 2011African Funk Experimentals (1979 to 1981)Album • 2016Fans also likeAmanazWITCHThe Lijadu SistersWillie WrightDry BreadSopwith CamelAlbumHow Do You FeelWorld PeaceOfege2:44Burning JungleOfege3:21Check It OutOfege4:04Bomp Your BootyOfege2:50Take Your Mind AwayOfege4:06How Do You FeelOfege4:13Ideal SituationOfege4:10Naira PowerOfege4:49Nature QueenOfege3:37FrustrationOfege3:30© 2022 Melvin Ukachi, Paul Alade, M-Ike Meme℗ 1978 Melvin Ukachi, Paul Alade, M-Ike MemeHomeSearchYour LibraryPremium Burning JungleOfegeHow Do You Feel19783:21ArtistOfegeRecommended based on this songBack To FunkyPasteur LappeHoliday ActionLivy EkemezieSexy DancerKiki GyanNa Real Sekele Fo'YaPasteur LappeGreetingsJoni HaastrupPopular Tracks by OfegeIt's Not Easy16,922,062Whizzy Ilabo441,356Nobody Fails630,656Burning Jungle814,779Popular Releases by OfegeTry and LoveAlbum • 1973How Do You FeelAlbum • 1978Higher Plane BreezeAlbum • 197751 Lex Presents: Lead Me On (Special Edition)Album • 2006The Last of the OriginsAlbum • 1976Popular Albums by Ofege51 Lex Presents: Lead Me On (Special Edition)Album • 2006How Do You FeelAlbum • 1978Higher Plane BreezeAlbum • 1977The Last of the OriginsAlbum • 1976Try and LoveAlbum • 1973Recommended releasesNa Man Pass ManAlbum • 1979Friday NightAlbum • 2016IvorySingle • 2025Next Stop Soweto 4: Zulu Rock, Afro-Disco & Mbaqanga 1975-1985Compilation • 2015Wake Up Your MindAlbum • 2011African Funk Experimentals (1979 to 1981)Album • 2016Fans also likeAmanazWITCHThe Lijadu SistersWillie WrightDry BreadSopwith CamelAlbumHow Do You FeelWorld PeaceOfege2:44Burning JungleOfege3:21Check It OutOfege4:04Bomp Your BootyOfege2:50Take Your Mind AwayOfege4:06How Do You FeelOfege4:13Ideal SituationOfege4:10Naira PowerOfege4:49Nature QueenOfege3:37FrustrationOfege3:30© 2022 Melvin Ukachi, Paul Alade, M-Ike Meme℗ 1978 Melvin Ukachi, Paul Alade, M-Ike MemeHomeSearchYour LibraryPremium Burning JungleOfegeHow Do You Feel19783:21ArtistOfegeRecommended based on this songBack To FunkyPasteur LappeHoliday ActionLivy EkemezieSexy DancerKiki GyanNa Real Sekele Fo'YaPasteur LappeGreetingsJoni HaastrupPopular Tracks by OfegeIt's Not Easy16,922,062Whizzy Ilabo441,356Nobody Fails630,656Burning Jungle814,779Popular Releases by OfegeTry and LoveAlbum • 1973How Do You FeelAlbum • 1978Higher Plane BreezeAlbum • 197751 Lex Presents: Lead Me On (Special Edition)Album • 2006The Last of the OriginsAlbum • 1976Popular Albums by Ofege51 Lex Presents: Lead Me On (Special Edition)Album • 2006How Do You FeelAlbum • 1978Higher Plane BreezeAlbum • 1977The Last of the OriginsAlbum • 1976Try and LoveAlbum • 1973Recommended releasesNa Man Pass ManAlbum • 1979Friday NightAlbum • 2016IvorySingle • 2025Next Stop Soweto 4: Zulu Rock, Afro-Disco & Mbaqanga 1975-1985Compilation • 2015Wake Up Your MindAlbum • 2011African Funk Experimentals (1979 to 1981)Album • 2016Fans also likeAmanazWITCHThe Lijadu SistersWillie WrightDry BreadSopwith CamelAlbumHow Do You FeelWorld PeaceOfege2:44Burning JungleOfege3:21Check It OutOfege4:04Bomp Your BootyOfege2:50Take Your Mind AwayOfege4:06How Do You FeelOfege4:13Ideal SituationOfege4:10Naira PowerOfege4:49Nature QueenOfege3:37FrustrationOfege3:30© 2022 Melvin Ukachi, Paul Alade, M-Ike Meme℗ 1978 Melvin Ukachi, Paul Alade, M-Ike MemeHomeSearchYour LibraryPremium"
1385,192,Лишний хлеб,,1966,Advertisement/promotional text,"Home Films Extra Bread Creators and actors About the film Creators and actors Video Review Stills Publications Film in collections Watch online More From the director Similar films Awards Posters Creators of the film Extra Bread - directors, actors, crew drama Soviet Union USSR Main topics View all Articles The most iconic images from film musicals In the world box office - the musical “Evil. Part 2”, continuation of the story about the difficult friendship of a kind, but not very talented graduate of a magical university and also a kind, but super-gifted sorceress."
1430,42,Гроза над Белой,,1968,Advertisement/promotional text,"The film tells about an episode of the Civil War, when troops under the command of M. The plot begins in February 1919, when Frunze leads the 4th Army of the Red Army."
1450,62,Отклонение,Detour,1967,Advertisement/promotional text,"A detour or (British English: diversion) is a (normally temporary) route taking traffic around an area of prohibited or reduced access, such as a construction site. Standard operating procedure for many roads departments is to route any detour over roads within the same jurisdiction as the road with the obstructed area."
1464,76,Романс для корнета,Romance pro křídlovku,1966,Bot activity message,"Romance for the Krydlovka is a Czech bitter poetic-romantic film directed by Otakar Vávra from 1966, based on the poem of the same name by František Hrubín, who also co-wrote the screenplay for this film. The then young actor Jaromír Hanzlík and the Slovak actress Zuzana Cigánová perform in the main roles, Miriam Kantorková also performed an unforgettable performance here. In the wider context of Czechoslovak cinematography, this is a relatively rare example of a unique film work, which is an attempt to visually rewrite a larger poetic work (film poem) belonging to the field of classic Czech literature of the 20th century. Almost the entire plot of the film takes place in the vicinity of Lešan in the lower Sazava, where František Hrubín spent his youth. A sad poetic story about the meeting of a young person - student Vojta (Jaromír Hanzlík) - both with his first great love, Terina (Zuzana Cigánová), and with death (Vojta's grandfather). Light Penets the Darkness (short film) (1930) • The Baťovi's Trip to Yugoslavia (commercial film) (1930) • Modern Shoe Production (commercial film) (1931) • We in Prague (short feature) (1934) • November (short film) (1935) • The Camel in the Eye of a Needle (1936) • Philosophical History (1937) • Virginity (1937) • The Guild of Kutnohorský Maidens (1938) • One Hundred Percent (advertising film) (1938) • The Girl in Blue (1939) • Humoreska (1939) • The Magical House (1939"
1469,81,Под пеплом - огонь,,1967,Advertisement/promotional text,"Home Films Under Ashes - Fire Under Ashes - Fire (film, 1967) Pod peplom ogon 1967 drama Soviet Union USSR About the film Creators and actors Video Review Stills Publications Film in collections Watch online More From the director Similar films Awards Posters Rate the film 1 2 3 4 5 6 7 8 9 10 - Viewers (0) - film. ru - IMDb Information Country Soviet Union USSR Year 1967 Genre drama Time 86 minutes Creators and actors Director Abdusalom Rakhimov Actors Ulmas Alikhodzhayev Mikhail Imatshoyev Tamara Kokova Gurgen Tonunts Sofia Tuibayeva View all Main topics View all Articles The most iconic images from film musicals In the world box office - musical “Evil."
1489,101,Лучшие годы,"Best Years, The",1964,Advertisement/promotional text,"15 ContributorsBEST YEARS Lyrics[Text of the song “BEST YEARS”][Intro]E (Gr-r, ka, ka) [Chorus] I’m buying a car, interior with white leather, it was created by people with black skin (Negroes) Your rap is weak, you want to get back into the charts, to raise the hype you need to die Ten lyams for mine desk on the track, but if you're white from the streets, I'll throw it off for eight (No) Bro, I would become a big stepper even if my feet were thirty-five (Okay) Whoa, whoa, whoa, dropped, and the feeling that the world has changed “451 degrees”, because my clients like to set fire to books (Go) You're a fucked up broke, you brought the tests not even in a jar, but in a box of matches (Fuck) If you see me in a jar with homeless people, these are my drops, we're here for cash (Cash)U, she will jerk me off with her feet, today is her leg day (E)U, I’m ashamed to talk to the Gods, I’ll go to hell for shit talk (E)U, they listen to me there, I’ll go on a tour in hell for nine circles (Skrrt) I fucked a bitch, promised to subscribe to her, left - threw it in the block (Leaked) I know a hundred ways to cheat a bitch, I don’t know a single discount in CS'ke (Oh) You're an Internet junkie, I know you're on Yandex Zen and Google Perk (Oh) I wanted - I ended up on the other side of the world, it's not because of the VPN (Yeah) She gives me a throat so I can wear a T-shirt of her shitty brand (Fuck) Maybe my sperm will inspire her to a new design for T-shirts (Style) You raised first dibs with muzla, when I sold my microphones (My own) I started fucking before my dick even grew hair (Yes) After my album of these bars, dopamine will not be restored for a week (E, a) [Chorus] I’m buying a car, interior with white leather, it was created by people with black skin (Negroes) Your rap is weak, if you want to get back into the charts, to raise the hype you need to die (Ah) Ten lyams for my desk on the track, but if you're white from the streets, I'll throw it off for eight down into individual linesUse section headers above different song parts like [Verse], [Chorus], etc. Use italics (<i>lyric</i>) and bold (<b>lyric</b>) to distinguish between different vocalists in the same song partIf you don’t understand a lyric, use [."
1494,106,Тревожное утро,Қилы кезең,1966,Advertisement/promotional text,Troubled relations between Kazakhstan and China. Commissioner Toktar Baitenov leads a small detachment of Chekists.
1504,116,К свету! (киноальманах),,1966,HTML/technical artifacts,"Cinema - Towards the Light&#33; (film almanac) (1966) - Towards the light&#33; (film almanac) (1966) Year 1966 Studio Dovzhenko Film Studio Release date April 22, 1968 Genre Drama, historical film Actors and crew Boris Shilenko Director Vasily Lapoknysh Director Nikolai Ilyinsky Director Grigory Kolesnik Screenwriter Evgeniy Onoprienko Screenwriter Vasily Countryman Screenwriter Naum Slutsky Director of photography Alexander Pishchikov Director of photography Valery Kvas Director of photography Vadim Gomolyaka Composer Anatoly Mamontov Production designer Georgy Prokopets Production designer Neonila Gnepovskaya Actor, Aunt Gannusya Ivan Lapikov Actor Georgy YumatovActor, PantalakhaIvan PereverzevActor, chimney sweepVictor PolishchukActorVsevolod SafonovActor, ZamyakhovskyFedor PanasenkoActor, Mikola GrachVladimir DalskyActorOleg ArtemchukActorVasily BogostaActorVadim IlyenkoActorNatalia NaumActorNikolai SulimaActorValery BessarabActor, prisonerPyotr FilonenkoActor Cinema - Towards the light&#33; (film almanac) (1966) - Towards the light&#33; (film almanac) (1966) Year 1966 Studio Dovzhenko Film Studio Release date April 22, 1968 Genre Drama, historical film Actors and crew Boris Shilenko Director Vasily Lapoknysh Director Nikolai Ilyinsky Director Grigory Kolesnik Screenwriter Evgeniy Onoprienko Screenwriter Vasily Countryman Screenwriter Naum Slutsky Director of photography Alexander Pishchikov Director of photography Valery Kvas Director of photography Vadim Gomolyaka Composer Anatoly Mamontov Production designer Georgy Prokopets Production designer Neonila Gnepovskaya Actor, Aunt Gannusya Ivan Lapikov Actor Georgy YumatovActor, PantalakhaIvan PereverzevActor, chimney sweepVictor PolishchukActorVsevolod SafonovActor, ZamyakhovskyFedor PanasenkoActor, Mikola GrachVladimir DalskyActorOleg ArtemchukActorVasily BogostaActorVadim IlyenkoActorNatalia NaumActorNikolai SulimaActorValery BessarabActor, prisonerPyotr FilonenkoActor Cinema - Towards the light&#33; (film almanac) (1966) - Towards the light&#33; (film almanac) (1966) Year 1966 Studio Dovzhenko Film Studio Release date April 22, 1968 Genre Drama, historical film Actors and crew Boris Shilenko Director Vasily Lapoknysh Director Nikolai Ilyinsky Director Grigory Kolesnik Screenwriter Evgeniy Onoprienko Screenwriter Vasily Countryman Screenwriter Naum Slutsky Director of photography Alexander Pishchikov Director of photography Valery Kvas Director of photography Vadim Gomolyaka Composer Anatoly Mamontov Production designer Georgy Prokopets Production designer Neonila Gnepovskaya Actor, Aunt Gannusya Ivan Lapikov Actor Georgy YumatovActor, PantalakhaIvan PereverzevActor, chimney sweepVictor PolishchukActorVsevolod SafonovActor, ZamyakhovskyFedor PanasenkoActor, Mikola GrachVladimir DalskyActorOleg ArtemchukActorVasily BogostaActorVadim IlyenkoActorNatalia NaumActorNikolai SulimaActorValery BessarabActor, prisonerPyotr FilonenkoActor"
1570,55,Тайна деревянных идолов,Mord am Montag,1968,Advertisement/promotional text,"Monika Stangel, a prostitute who is in the middle of a big fraud, is murdered in her apartment. The Laube police inspector quickly finds many leads to the perpetrators of the murder, but everything is tangled up due to lies and false testimonies."
1573,58,Ущелье ведьм,"Wall of Witches, The",1967,Unusually long word (possibly encoded),ruMailMy WorldOdnoklassnikiVKGamesDatingNewsCalendarCloudNotesAll projectsAll projectssign outSign upSign in Any length By relevance HD Reset Download Music Games Groups News feed Friends Photos Video Music Groups Gifts Games Witches' Gorge (1967) rus sub Alexander Bakalkin 11/47/2025 Comment Like VKontakte Odnoklassniki Log in to My World to comment The sweetest Super top 31 978 08.
1583,68,Каратель,,1968,Advertisement/promotional text,"The Punisher The Punisher (film, 1968) Kal 1968 melodrama Soviet Union USSR About the film Creators and actors Video Review Stills Publications Film in collections Watch online More From the director Similar Awards Posters the film 1 2 3 4 5 6 7 8 9 10 — Viewers (0) — film. ru 7.1 IMDb Information Country Soviet Union USSR Year 1968 Genre melodrama Time 85 minutes Premiere August 3, 1969 (WORLD) Creators and actors Director Manos Zacharias Actors Evgeniy Kindinov Maria Vandova Victor Voinichescu-Sotski Georgiy Burkov Sergei Shakurov Sotiros Belevendis See all About the film The action takes place in Greece in the 70s"
1630,13,Самозванец с гитарой,Big Beat,1966,Advertisement/promotional text,"The Big Beat is a 1958 American musical comedy film distributed by Universal International, which was directed and produced by Will Cowan, written by David P. Harmon, and starred William Reynolds, Andra Martin, Gogi Grant, and Jeffrey Stone. It was shot in Eastmancolor, by Pathe, and was released on May 24, 1958, as a double bill with Summer Love. The story is about a young man fresh out of college named John Randall who tries to persuade his father, a record company owner, to start signing up rock 'n' roll acts. This film is well known to have featured many famous and popular singers, musicians, and musical groups of the 1950s, including Charlie Barnet, Buddy Bregman, Alan Copeland, The Del-Vikings, and Jeri Southern. In New York, Joseph Randall (Bill Goodwin), the owner of Randall Records, names his son John (William Reynolds) as the company's new vice-president, to the pleasure of A&R man Danny Phillips (Jeffrey Stone). John immediately urges his father to eschew the company's middle-of-the-road love ballads in favor of newer musical genres, such as rock and roll, calypso or rhythm and blues, but Joseph refuses to deviate from the standards. For this reason, Danny's girlfriend, celebrity singer Cindy Adams (Gogi Grant), has decided not to sign a contract with Randall Records"
1695,78,Флиппер,Flipper,1963,Advertisement/promotional text,"1-16 of 103 results for ""flipper dev boards"" Sort by: Featured Price: Low to High Price: High to Low Avg. Customer Review Newest Arrivals Best Sellers Sort by:Featured Go Smart whiteboard for business and schoolSponsored|Shop TIBURNShop now Previous pageTIBURN R2 75"" 4K UHD Smart Board | Smart Digital Whiteboard | All-in-One Touch Screen Computer with Open App Ecosystem, Includes Movable Stand+Wall Mount, Ideal for Office, Classroom, and Conference5 5 out of 5 stars."
1742,125,Красное и золотое,"Red and the Gold, The",1969,Advertisement/promotional text,"Home Films Red and Gold Red and Gold (film, 1969) Czerwone i zlote 1969 comedy Poland About the film Creators and actors Video Review Stills Publications Film in collections Watch online More From the director Similar films Awards Posters Rate the film 1 2 3 4 5 6 7 8 9 10 10 Viewers (1) — film. ru - IMDb Information Country Poland Year 1969 Genre comedy Time 98 minutes Creators and actors Directors Stanislaw Lenartowicz Beata Bilska Wlodzimierz Olszewski Actors Zdzislaw Karczewski Jadwiga Chojnacka Wieslawa Niemyska Zygmunt Bielawski Jerzy Blek Kazimierz Debicki See all From the director To ja zabilem To ja zabilem, 1975 Cala naprzód Cala naprzód, 1967 An Italian in Warsaw Giuseppe w Warszawie, 1964 Main topics View all Articles The most iconic images from film musicals The musical “Evil."
1796,4,Сын прокурора,Duniya,1968,Advertisement/promotional text,"The Web's Largest Resource for Definitions & Translations A Member Of The STANDS4 Network Free, no signup required: Add to Chrome Get instant definitions for any word that hits you anywhere on the web. Two clicks install » Free, no signup required: Add to Firefox Get instant definitions for any word that hits you anywhere on the web."
1832,40,Узники Бомона,,1970,Advertisement/promotional text,"Prisoners of Beaumont Prisoners of Beaumont (film, 1970) 1970 drama Soviet Union USSR About the film Creators and actors Video Review Stills Publications Film in collections Watch online More From the director Similar Awards Posters the film 1 2 3 4 5 6 7 8 9 10 — Viewers (0) — film. ru — IMDb Information Country Soviet Union USSR Year 1970 Genre drama Premiere April 18, 1971 (Russia) Creators and actors Actors Maria Kapnist Alexander Parknko See all About the film Dedicated to the heroic page of the biography of Hero of the Soviet Union Vasily Porik (1920-1944), organizer of a group of underground fighters in the French camp Beaumont"
1846,54,Большая любовь,"Grand amour, Le",1968,Advertisement/promotional text,"True love ©Getty - Anthony Harvie How do we recognize true love. Thursday April 20, 2017 listen (52 min) Advertisement Has loving capitalism killed Great Love."
1865,73,"И был вечер, и было утро...",,1970,Advertisement/promotional text,"About the dramatic conflict caused by the revolutionary events of 1917 in the family of captain 1st rank Bersenev, commander of the cruiser “Zarya” (the prototype is the cruiser “Aurora”, which is also the location where the film was filmed), the events take place in the Bersenevs’ house and on the cruiser stationed in the roadstead of Kronstadt. June 1917, after the shooting of a demonstration on Nevsky, the sailors of the cruiser Zarya who participated in the demonstration return to Kronstadt."
1897,105,Ожидание,,1969,Advertisement/promotional text,"Waiting Waiting (film, 1969) 1969 drama Soviet Union USSR About the film Creators and actors Video Review Stills Publications Film in collections Watch online More From the director Similar Awards Posters the film 1 2 3 4 5 6 7 8 9 10 — Viewers (0) — film. ru — IMDb Information Country Soviet Union USSR Year 1969 Genre Drama Main themes View all Articles The most iconic images from film musicals The musical “Evil"
1910,118,Красная рябина,Red Rowan,1969,Advertisement/promotional text,"“Red Rowan” (Polish: Jarzębina czerwona) is a 1969 Polish war film directed by Ewa and Czesław Petelski, based on the novel “Front Roads” by Waldemar Kotowicz. Soviet and Polish soldiers work together to take the Kolberg fortress in one of the largest battles fought by regular Polish troops in World War II."
1911,119,Рыцарь королевы,Karalienes bruņinieks,1970,Bot activity message,"Home / Books / Romance Fantasy / Anastasia Litskikh Knight of the Queen Author: Anastasia Litskikh Like (1) (0) (2) #1090 in Romance Fantasy #2920 in Fantasy New Knight of the Queen Author: Anastasia Litskikh Like (1) (0) (2) Age limit: 16+ Format: Story Like (1) (0) (2) #forbidden feelings #forbidden relationships #strong heroine #knights #romantic relationships #1090 in Romance fantasy #2920 in Fantasy She is a queen who holds the fate of an entire state in her hands. He is her faithful knight, in the hands of whom is not only her safety, but also a brave, ardent heart."
1923,131,Заблудшие,Valge laev,1970,Advertisement/promotional text,"A student company of young Estonian nationalists, listening to “Western radio voices,” falls under the influence of the ideologist of the Estonian emigration, radio host Rudolf Talgre, who collaborated with the Nazis during the war and was proud of it, and has now settled in Sweden. However, one of the friends begins to doubt the correctness of the “voice”, which leads to a quarrel between friends."
1924,132,Крутой горизонт,,1970,Advertisement/promotional text,A new director has been appointed to one of the Donbass coal mines. His peculiar method of leadership - constant reprimands and wild assault - naturally leads to an accident.
1925,133,Дороги бывают разные,Роҳи сафар гуногун аст,1970,Advertisement/promotional text,“There are different roads” (1970) - Video from Feature filmsVK Video›Feature filmsVideo sourceVideo text x. “There are different roads” (1970) - Video from Feature films1.
1926,134,Две улыбки (киноальманах),,1970,Advertisement/promotional text,"Home Films Two Smiles (film almanac) Two Smiles (film almanac) (film, 1969) 1969 About the film Creators and actors Video Review Stills Publications Film in collections Watch online More From the director Similar films Awards Posters Rate the film 1 2 3 4 5 6 7 8 9 10 — Viewers (0) — film. ru — IMDb Information Year 1969 Creators and actors Actors Zoya Vasilkova Georgy Millyar Irina Volkova See all Main topics See all Articles The most iconic images from film musicals Worldwide release - the musical “Evil."
1931,139,Пеппи Длинныйчулок,Pippi Longstocking,1969,Possible encoded text,"Pippi Longstocking AboutAssignmentPippiEditionsCover ImagesBibliographic DescriptionPublicationSequelsAdaptionsTranslationsThe CreatorsAstrid LindgrenIngrid NymanReceptionReviews & RecommendationsEvaluation of TextBibliography Media Adaptions 1949 Film Four years after the original book was published, Pippi made her first appearance in film. The movie was based on the first three books (Pippi Longstocking, Pippi Goes to School and Pippi in the South Seas"
1936,144,Как стать мужчиной (киноальманах),,1970,Advertisement/promotional text,"Home Films How to become a man (film almanac) How to become a man (film almanac) (film, 1970) The Ripper Society 1970 About the film Creators and actors Video Review Stills Publications Film in collections Watch online More From the director Similar films Awards Posters Rate the film 1 2 3 4 5 6 7 8 9 10 — Viewers (0) — film. ru - IMDb Information Year 1970 Premiere July 3, 2017 (WORLD) Creators and actors Actor Ekaterina Vasilyeva See all Main topics See all Articles The most iconic images from film musicals Worldwide release - the musical “Evil."
1964,172,Царь Чах-Чах (киноальманах),,1969,Advertisement/promotional text,"Home Films Tsar Chakh-Chakh (film almanac) Creators and actors About the film Creators and actors Video Review Stills Publications Film in collections Watch online More From the director Similar films Awards Posters Creators of the film Tsar Chakh-Chakh (film almanac) - directors, actors, crew drama Soviet Union USSR Main topics See all Articles The most iconic images from film musicals In the world box office - the musical “Evil. Part 2”, continuation of the story about the difficult friendship of a kind, but not very talented graduate of a magical university and also a kind, but super-gifted sorceress."
